Bavarois framboise-chocolat,"Ingrédients : oeuf,beurre,chocolat,sucre,farine,orange,rhum,framboises (surgelées ou fraîches),citron,gélatine,crème liquide,sucre,coulis (framboise ou fruits rouges),gélatine,macaron framboise,macaron...",1h10,3
Poulet au four,"Ingrédients : poulet fermier d'environ 1,8 kg,oignon frais,tomate cerise,ail selon le goût,jus de citron,bouillon de volaille dilué dans un verre d'eau,feuille de laurier,sel gros,poivre.Préchauffer le four à...",1h55,2
"Frittata tomates cerises, épinards","Ingrédients : oeuf,oignon,huile d’olive vierge extra Costa d’Oro L’Italiano,tomate cerise,pousses d'épinard,sel,poivre,parmesan râpé.Laver les tomates cerises et les couper en 2....",25 min,3
"Gnocchis, poivrons rouges et courgettes","Ingrédients : gnocchi,poivron rouge,courgette,huile d’olive vierge extra BIO Costa d’Oro Il Biologico,ail,sel,poivre,poivron rouge,crème fraîche,parmesan râpé,huile d’olive vierge...",45 min,2
Feuilletés apéritifs de printemps,"Ingrédients : Pâte feuilletée TARTE EN OR HERTA®,tomate cerise,oeuf,fromage blanc battu,tapenade,pesto,emmental râpé,ciboulette,poivre,sel.Préchauffez le four à 200°c.Etalez la...",25 min,2
Kéfir à l'eau,"Ingrédients : sucre par litre d'eau,kéfir par litre d'eau,figue sèches,citron.Mettre dans le récipient tous les ingrédients. Il est préférable de faire fondre le sucre avant. Remplir d'eau avec la quantité que...",1 j,1
Lapin au caramel,"Ingrédients : lapin de 1,2 kg,oignon,sucre,moutarde de vinaigre,poivre,sel,huile.Laisser cuire à feu doux 20 mn.Remettre le lapin dans la cocotte, saler, poivrer, couvrir, puis laisser cuire 20 mn en veillant à ce...",40 min,3
Bouchées apéritives de croustillants au fromage et compotée de...,"Ingrédients : Deli’CHEESE Saint Albray,pain,figue,cassonade,vinaigre balsamique,huile d'olive,citron,sel,poivre.Préparation du confit de figues....",45 min,2
Biscuits de Noël aux amandes (Alsace),"Ingrédients : farine,beurre,amande en poudre,sucre,sucre vanillé,sucre glace.Enfourner dans le four préalablement préchauffé à 200°C pendant environ 10 min (les biscuits ne doivent pas colorer). Laisser...",1h10,2
